<?xml version="1.0" encoding="UTF-8" standalone="no"?>
<UserSettings xmlns:te_qt_af="http://www.terralib.org/schemas/qt/af"
         xmlns:xlink="http://www.w3.org/1999/xlink"
         xmlns:xsd="http://www.w3.org/2001/XMLSchema-instance"
         xmlns="http://www.terralib.org/schemas/qt/af"
         xsd:schemaLocation="http://www.terralib.org/schemas/qt/af usettings.xsd"
         version="5.0.0">
  <SelectedIconTheme>tango</SelectedIconTheme>

  <LastSearchedFolder xlink:href="C:/Users/gribeiro/Documents"/>

  <ToolBarIconSize>24</ToolBarIconSize>
  
  <DefaultSRID>4326</DefaultSRID>
  
  <SelectionColor>#00FF00</SelectionColor>

  <SpecificPlugins>
    <Plugin>
      <Name>te.da.gdal</Name>
      <Path xlink:href="plugins\gdal\plugin_info.xml" />
    </Plugin>
    <Plugin>
      <Name>te.plugin.exchanger</Name>
      <Path xlink:href="plugins\plugin_exchanger\plugin_info.xml" />
    </Plugin>
    <Plugin>
      <Name>te.cellspace.builder</Name>
      <Path xlink:href="plugins\plugin_cellspace_builder\plugin_info.xml" />
    </Plugin>
  </SpecificPlugins>

  <EnabledPlugins>
    <Plugin>te.da.ogr</Plugin>
    <Plugin>te.da.gdal</Plugin>
    <Plugin>te.da.pgis</Plugin>
    <Plugin>te.plugin.builder</Plugin>
  </EnabledPlugins>

  <DataSourcesFileName>datasources.xml</DataSourcesFileName>

  <MostRecentProject xlink:href="../../conf/project.xml"/>

  <RecentProjects>
    <Project xlink:href="../../conf/brasil.xml" title="Atlas Brasil"/>
    <Project xlink:href="../../conf/project.xml" title="Estudo Agricola do Estado de Minas Gerais"/>
    <Project xlink:href="../../conf/super-project.xml" title="Super projeto"/>
  </RecentProjects>
</UserSettings>